TITLE,DESCRIPTION,PRICE,CURRENCY_CODE,QUANTITY,TAGS,MATERIALS,IMAGE1,IMAGE2,IMAGE3,IMAGE4,IMAGE5,IMAGE6,IMAGE7,IMAGE8,IMAGE9,IMAGE10,"VARIATION 1 TYPE","VARIATION 1 NAME","VARIATION 1 VALUES","VARIATION 2 TYPE","VARIATION 2 NAME","VARIATION 2 VALUES",SKU
"Elegant Red Faux Floral Arrangement | Tall Silk Gladiolus Lily Inspired Decor | Tan Woven Ceramic Harrow Vase","Make a striking statement in your home or office with this exquisite Elegant Red Faux Floral Arrangement, artfully designed by BonnieLassFlorals. This tall and dramatic piece features an abundance of vibrant red blooms, reminiscent of graceful gladiolus or elegant lilies, beautifully complemented by lush, trailing green fern-like foliage.

The arrangement is meticulously set in a sophisticated Harrow Tan Woven Ceramic Vase, adding a natural yet refined texture to the overall aesthetic. The unique woven pattern of the vase enhances the arrangement's organic feel, making it a perfect blend of modern elegance and natural charm. Standing impressively tall, this piece is an ideal focal point for an entryway, living room, dining area, or any space where you want to create a grand and inviting atmosphere.

Enjoy the everlasting beauty of lifelike blooms without the need for maintenance. This stunning arrangement provides year-round color and sophistication to your decor.

Features You'll Love:

Vibrant Red Blooms: High-quality faux flowers inspired by gladiolus and lilies for a striking visual impact.
Lush Greenery: Realistic fern-like foliage adds depth and natural beauty.
Unique Harrow Vase: Attractive tan woven ceramic vase provides a sophisticated foundation.
Impressive Scale: Tall and dramatic design creates an immediate focal point.
Low Maintenance: Enjoy the beauty of flowers year-round with no watering or wilting.
Versatile Elegance: Perfect for foyers, living rooms, dining rooms, offices, and more.
Dimensions (Approximate):

Width: 15 inches
Height: 36 inches
Materials:

High-quality artificial silk flowers and plastic greenery
Harrow tan woven ceramic vase
Care Instructions:
To maintain its pristine appearance, gently dust the arrangement with a soft cloth or use a hairdryer on a cool, low setting to remove any accumulated dust.

Add a touch of timeless elegance and a pop of rich color to your space with this stunning faux floral masterpiece from BonnieLassFlorals!",125,USD,1,"woven-like_vase,dogwood,gladiolus,pheasant_feathers,summer,floral,arrangement,elegant,interior_decor,bonnielassflorals","silk florals,silk greens,pheasant feathers,ceramic vase,metal wire,plastic stems,wooden picks,hot glue,floral foam",https://i.etsystatic.com/57756784/r/il/2bfe08/6934689269/il_fullxfull.6934689269_jizw.jpg,https://i.etsystatic.com/57756784/r/il/aaa7ec/6833627100/il_fullxfull.6833627100_om32.jpg,https://i.etsystatic.com/57756784/r/il/5ddcd3/6819401882/il_fullxfull.6819401882_f9id.jpg,https://i.etsystatic.com/57756784/r/il/797115/6833630948/il_fullxfull.6833630948_oq9m.jpg,https://i.etsystatic.com/57756784/r/il/2af27e/6936754799/il_fullxfull.6936754799_8m88.jpg,https://i.etsystatic.com/57756784/r/il/0444be/6888780234/il_fullxfull.6888780234_728p.jpg,,,,,,,,,,,
"Elegant Pink And White Peony And Rose Faux Floral Arrangement | Glass Vase with Ostrich Feathers | Pretty Table Decor","Faux Floral Arrangement, beautifully crafted by BonnieLassFlorals. This delightful bouquet features a harmonious blend of vibrant hot pink peonies and delicate pale pink roses, creating a sweet and sophisticated display.

Lush green ivy foliage provides a natural backdrop, while soft, ethereal white ostrich feathers add a unique touch of graceful luxury. The flowers are carefully arranged in a chic glass vase, allowing the beauty of the stems to subtly show through and enhancing the overall light and airy feel.

Measuring 15 inches in width and 20 inches in height, this arrangement is the perfect size to serve as a stunning centerpiece for your dining table, a charming accent on a coffee table or bedroom dresser, or a welcoming touch in an entryway. Enjoy the enduring beauty of these lifelike blooms year-round, with no watering or wilting required.

Features You'll Love:

Charming Pink Blooms: Realistic hot pink peonies and pale pink roses offer lasting beauty.
Unique Ostrich Feather Accents: Adds a touch of softness and sophisticated elegance.
Lush Greenery: Ivy foliage creates a natural and full appearance.
Stylish Glass Vase: A clear and elegant base that complements any decor.
Perfectly Sized: Ideal for various surfaces, providing a noticeable yet balanced presence.
Effortless Beauty: Enjoy beautiful flowers without the maintenance.
Dimensions (Approximate):

Width: 15 inches
Height: 20 inches
Materials:

High-quality artificial silk flowers (peonies, roses)
Faux ivy greenery
Real white ostrich feathers
Glass vase
Care Instructions:
To maintain its beauty, gently dust the arrangement with a soft cloth or use a hairdryer on a cool, low setting to remove any accumulated dust.

Thank you for supporting BonnieLassFlorals! As a seller with a 5-star rating, we are committed to your satisfaction and gladly accept returns and exchanges within 30 days.",50,USD,1,"vase,pink,roses,peonies,colorful,ostrich,feathers,decor,spring,summer,bonnielassflorals","silk florals,silk greenery,floral tape,floral picks,hot glue,glass",https://i.etsystatic.com/57756784/r/il/2b8e18/6886701522/il_fullxfull.6886701522_rkqa.jpg,https://i.etsystatic.com/57756784/r/il/2a462d/6834856324/il_fullxfull.6834856324_27ej.jpg,https://i.etsystatic.com/57756784/r/il/f0f5f3/6886706532/il_fullxfull.6886706532_bff5.jpg,https://i.etsystatic.com/57756784/r/il/35bc68/6817354116/il_fullxfull.6817354116_eley.jpg,https://i.etsystatic.com/57756784/r/il/1bd38b/6865340165/il_fullxfull.6865340165_769d.jpg,https://i.etsystatic.com/57756784/r/il/4c317d/6817354084/il_fullxfull.6817354084_5dp5.jpg,,,,,,,,,,,
"Wooden Cowboy Boot Faux Floral Arrangement | Orange Mini Sunflower & Carnation Decor | Rustic Western Accent Vase","Saddle up your decor with this adorable and charming Wooden Cowboy Boot Faux Floral Arrangement from BonnieLassFlorals! Perfect for adding a touch of rustic Western flair to any space, this unique piece brings a cheerful pop of color and country charm.

This handcrafted arrangement features a cute wooden cowboy boot vase, filled with a vibrant mix of bright orange mini carnations and sunny mini sunflowers. Playful mini berry picks and lush ivy greenery complete the look, creating a miniature bouquet that's bursting with personality. It's the perfect accent for a bookshelf, desk, windowsill, or a themed room.

Only 1 left in stock! Don't miss out on this unique piece of country decor.

Features You'll Love:

Unique Cowboy Boot Vase: A delightful and eye-catching wooden vessel.
Vibrant Faux Blooms: Features cheerful orange mini carnations and mini sunflowers for lasting color.
Rustic Accents: Adorned with berry picks and ivy greenery for a natural touch.
Compact Size: Perfect for smaller spaces, adding charm without overwhelming.
Effortless Beauty: Enjoy beautiful flowers and a unique vase year-round with no maintenance.
Dimensions (Approximate):

Width: 7 inches
Height: 10 inches
Materials:

Wooden cowboy boot vase
High-quality silk mini carnations and sunflowers
Faux berry picks and ivy greenery
Metal wire and hot glue
Care Instructions:
To maintain its beauty, gently dust with a soft cloth or use a hairdryer on a cool, low setting to remove any accumulated dust.

Add a touch of the Wild West to your home or give the perfect gift to a cowboy or cowgirl at heart! As a 5-star rated seller, BonnieLassFlorals is committed to quality and your satisfaction.

Good news! Etsy offsets carbon emissions from shipping and packaging on this purchase.",30,USD,1,"cute,western,cowboy,boot,vase,decoration,decor,summer,spring,bonnielassflorals","wood,wood vase,wooden stake,metal wire,silk flowers,silk greens,plastic,hot glue",https://i.etsystatic.com/57756784/r/il/ca9892/6888449924/il_fullxfull.6888449924_fpvg.jpg,https://i.etsystatic.com/57756784/r/il/5fcf50/6888449922/il_fullxfull.6888449922_2625.jpg,,,,,,,,,,,,,,,
"Vintage Inspired Faux Floral Arrangement | Silk Irises & Old-Fashioned Roses | Unique Hand-Finished Container Decor","Step back in time with this exquisite Vintage Inspired Faux Floral Arrangement, a timeless creation from BonnieLassFlorals. This elegant piece captures the enduring beauty of classic garden blooms, thoughtfully arranged in a truly unique, hand-finished container.

The arrangement features a harmonious blend of stately silk irises and romantic old-fashioned roses, nestled amongst lush greenery. Each bloom is selected for its lifelike detail, ensuring a display that offers lasting beauty without any maintenance. The charm of this piece is elevated by its one-of-a-kind container, which has been artfully hand-finished with tissue paper and a textured cloth braid, giving it a rich, vintage patina and tactile appeal.

Standing at an impressive 24 inches in height, this arrangement makes a stunning centerpiece for your dining table, a grand accent for an entryway console, or a sophisticated addition to your living room or study. It's the perfect way to infuse your space with nostalgic elegance and enduring charm.

Features You'll Love:

Classic Floral Design: Features realistic silk irises and old-fashioned roses.
Unique Hand-Finished Container: Artisan container created with tissue paper and cloth braid for a distinct vintage look.
Lush Greenery: Adds depth and natural volume to the arrangement.
Permanent Beauty: Enjoy the look of fresh flowers year-round with no watering or wilting.
Grand Scale: At 24 inches tall, it makes a significant decorative statement.
Versatile Vintage Appeal: Complements traditional, shabby chic, cottagecore, or eclectic decor styles.
Dimensions (Approximate):

Width: 16 inches
Height: 24 inches
Materials:

High-quality silk flowers (irises, roses) and artificial greenery
Container hand-finished with tissue paper and cloth braid (over a base material like ceramic or wood)
Care Instructions:
To maintain its beautiful appearance, gently dust the arrangement with a soft cloth or use a hairdryer on a cool, low setting to remove any accumulated dust.

Infuse your home with the timeless elegance of this unique vintage-inspired floral arrangement from BonnieLassFlorals.",98,USD,1,"unusual,original,hand-drawn,large,victorian,metal_base,old-fashioned,bonnielassflorals","metal base,silk flowers,silk greens,floral tape,floral picks,hot glue,floral foam,tissue paper,cloth braid,plastic stems",https://i.etsystatic.com/57756784/r/il/6bd30f/6886618454/il_fullxfull.6886618454_rbh4.jpg,https://i.etsystatic.com/57756784/r/il/47dbef/6934672587/il_fullxfull.6934672587_jbqz.jpg,https://i.etsystatic.com/57756784/r/il/798f93/6812922758/il_fullxfull.6812922758_jkr5.jpg,https://i.etsystatic.com/57756784/r/il/b6bd89/6860915599/il_fullxfull.6860915599_qq8o.jpg,,,,,,,,,,,,,
"Humorous ""BACON SEED"" Pig Wreath | Rustic Farmhouse Decor with Red Clematis & Greenery | Country Kitchen Wall Art","Add a dash of wit and rustic charm to your home with this delightful Humorous ""BACON SEED"" Pig Wreath from BonnieLassFlorals! This handcrafted piece is the perfect accent for any farmhouse, country kitchen, or rustic-themed space, guaranteed to bring a smile to everyone's face.

Built on a sturdy natural twig and grapevine base, this wreath features lush artificial green and reddish-brown foliage that provides a rich, earthy backdrop. Vibrant red clematis flowers add a beautiful pop of color, making the wreath eye-catching and inviting.

The true stars of the show are the adorable metal pink pig cutout and the playfully ironic ""BACON SEED"" banner. This charming combination makes it an ideal conversation starter and a unique piece of wall art or a welcoming door display.

Features You'll Love:

Whimsical & Humorous Design: Features a charming pig cutout and a witty ""BACON SEED"" banner.
Rustic Farmhouse Appeal: Crafted on a natural twig and grapevine base, perfect for country decor.
Vibrant Faux Florals: Beautiful red clematis flowers and lush artificial foliage for lasting beauty.
Handcrafted Quality: Each wreath is thoughtfully assembled for a unique finish.
Versatile Display: Ideal for your kitchen, pantry door, entryway, or any wall in your home.
Dimensions (Approximate):

Width: 18 inches
Height/Depth: 6 inches
Materials:

Natural twig and grapevine wreath base
High-quality artificial green and reddish-brown foliage
Artificial red clematis flowers
Metal pig cutout
Fabric/wood banner with ""BACON SEED"" lettering
Care Instructions:
To maintain its fresh appearance, gently dust the wreath with a soft cloth or use a hairdryer on a cool, low setting to remove any accumulated dust. For outdoor display, it is recommended to place it under a covered area to protect it from harsh weather elements.

Bring a touch of playful farmhouse spirit to your home or give the perfect gift to a pig lover or a friend with a great sense of humor!",50,USD,1,"whimsical,handcrafted,wreath,farmhouse,pig,bacon,food_humor,artificial,decorative,home_decor,bonnielassflorals","grapevine,silk flowers,silk leaves,plastic,metal,floral stakes,metal wire,wooden sign,hot glue",https://i.etsystatic.com/57756784/r/il/6d4fa0/6936441197/il_fullxfull.6936441197_tchh.jpg,https://i.etsystatic.com/57756784/r/il/d80ae1/6888472796/il_fullxfull.6888472796_eup1.jpg,https://i.etsystatic.com/57756784/r/il/08b1f7/6858553345/il_fullxfull.6858553345_hl8f.jpg,,,,,,,,,,,,,,
"Pink & White Rose Faux Floral Arrangement | Cherub Ceramic Pot Decor | Romantic Baby's Breath Centerpiece","Infuse your space with angelic charm and romantic beauty with this exquisite Pink & White Rose Faux Floral Arrangement, lovingly crafted by BonnieLassFlorals. This delightful piece brings an everlasting touch of elegance, perfect for any room seeking a soft and whimsical accent.

This enchanting arrangement features a lush bouquet of realistic pink and white roses, beautifully accented with delicate pink baby's breath flowers that add a touch of ethereal grace. Vibrant greenery, including philodendron leaves, provides a verdant backdrop, highlighting the soft hues of the blooms.

The true star of this arrangement is its charming pink ceramic pot, adorned with a beautifully sculptured 3-D image of cherubs. This unique vase adds a touch of classic artistry and innocence, making the entire piece feel truly special and refined.

Ideal for a bedroom, nursery, living room, or as a romantic centerpiece for your dining table, this arrangement offers timeless beauty without the need for watering or maintenance.

Features You'll Love:

Romantic Rose & Baby's Breath Bouquet: High-quality pink and white faux roses paired with delicate pink baby's breath.
Unique Cherub Ceramic Pot: A charming pink vase featuring a detailed 3-D cherub sculpture, adding a touch of classical elegance.
Lush Greenery: Realistic philodendron leaves and other greenery provide a vibrant backdrop.
Everlasting Beauty: Enjoy vibrant, lifelike flowers year-round with zero maintenance.
Perfectly Sized: At 15 inches wide and 17 inches high, it's ideal for various surfaces.
Versatile Decor: Complements romantic, shabby chic, vintage, cottagecore, or nursery decor styles.
Dimensions (Approximate):

Width: 15 inches
Height: 17 inches
Materials:

High-quality silk flowers (roses, baby's breath)
Silk and plastic greenery (philodendron leaves)
Ceramic cherub pot
Wooden stakes, metal wire, hot glue, floral foam (internal structure)
Care Instructions:
To maintain its beautiful appearance, gently dust the arrangement with a soft cloth or use a hairdryer on a cool, low setting to remove any accumulated dust.

Thank you for choosing BonnieLassFlorals for your home decor needs! We are proud to have a 5-star review for this item, reflecting our commitment to quality. Your purchase also includes Etsy Purchase Protection for added peace of mind.",55,USD,1,"floral_arrangement,artificial_flowers,faux_flowers,home_decor,accents,gift_idea,planter,elegant,bonnielassflorals","silk flowers,silk greens,plastic greens,wooden stakes,metal wire,hot glue,ceramic,floral foam",https://i.etsystatic.com/57756784/r/il/45c1b7/6880257815/il_fullxfull.6880257815_7qjg.jpg,https://i.etsystatic.com/57756784/r/il/d76261/6888715364/il_fullxfull.6888715364_prli.jpg,https://i.etsystatic.com/57756784/r/il/345f5e/6810499952/il_fullxfull.6810499952_m1tp.jpg,,,,,,,,,,,,,,
"Elegant Blue Peony & White Jasmine Centerpiece - Spring/Summer Decor","Welcome the beauty of nature into your home with this stunning 20-inch grapevine wreath, a perfect blend of rustic charm and elegant floral design. This exquisite centerpiece is handcrafted with lush, deep blue faux peonies and delicate, white faux jasmine flowers, creating a captivating color palette.

Adding to its unique charm, the wreath features wispy berry swag for natural texture and graceful white ostrich feathers that softly intertwine with the botanicals. A peaceful white dove nestles gently within, offering a serene focal point and symbolizing peace and new beginnings.

Ideal for your front door, entryway, or as a striking wall decor piece, this durable faux flower wreath provides enduring beauty without the need for maintenance. Perfect for spring and summer decor, a thoughtful housewarming gift, or to add a touch of sophistication to any room. Bring a touch of the outdoors in with this timeless and beautifully crafted accent.",65,USD,1,"jasmine,peonies,spring,colorful,door_decor,elegant,handmade,bonnielassflorals","ostrich feathers,silk florals,silk greens,plastic greens,floral tape,floral wooden stakes,metal wiring,hot glue",https://i.etsystatic.com/57756784/r/il/d06ffb/6936435547/il_fullxfull.6936435547_sdpl.jpg,https://i.etsystatic.com/57756784/r/il/1552e2/6810427600/il_fullxfull.6810427600_3608.jpg,,,,,,,,,,,,,,,
"Cute and rustic farmhouse style 8"" grapevine wreath","Rustic and cute original 8 inch grapevine wreath. Wreath has a Ma and Pa chicken complete with nest and eggs. There is a wooden picket fence and a handmade wooden egg sign. It has orange and yellow daisy-like flowers accented with greenery.",65,USD,1,"farmhouse,wreath,decor,spring,summer,rustic,country,door_hanger,wall_hanger,handmade,easter,everyday_decor,bonnielassflorals","wooden fence,wooden sign,grapevine,styrofoam,feathers,copper wire,hot glue,wooden stakes",https://i.etsystatic.com/57756784/r/il/e35e20/6888544848/il_fullxfull.6888544848_pd0z.jpg,https://i.etsystatic.com/57756784/r/il/a6a063/6858385627/il_fullxfull.6858385627_ia2l.jpg,https://i.etsystatic.com/57756784/r/il/be69f1/6858385631/il_fullxfull.6858385631_7byj.jpg,,,,,,,,,,,,,,
"WELCOME SPRING - Farmhouse Wreath - Door Decor","Brighten your home with this charming ""WELCOME SPRING"" wreath! Features a rustic grapevine base with a white picket fence backdrop, accented with yellow daffodils, lavender, and other cheerful spring florals. Includes a decorative birdhouse and garden tool elements, perfect for adding a touch of farmhouse charm to your front door, entryway, or mantel.",89,USD,1,"spring,wreath,wall_decor,home_decor,rustic,floral,garden,farmhouse,whimsical,bonnielassflorals","vines,grapevines,silk flowers,wood fences,metal bike,metal wire,hot glue,wood stakes",https://i.etsystatic.com/57756784/r/il/8a53d9/6888497674/il_fullxfull.6888497674_lmaa.jpg,https://i.etsystatic.com/57756784/r/il/c674e1/6810169510/il_fullxfull.6810169510_md33.jpg,https://i.etsystatic.com/57756784/r/il/8f1653/6858165753/il_fullxfull.6858165753_5mib.jpg,https://i.etsystatic.com/57756784/r/il/b26679/6810169508/il_fullxfull.6810169508_cn1t.jpg,,,,,,,,,,,,,
"Striking Black Ostrich Feather Arrangement in Swan Basket","Make a statement with this incredibly unique and eye-catching artificial floral and genuine ostrich feather arrangement! Features dramatic black feathers, combined with a black and white striped floral accent, and sparkling teal glitter decorative loops. All beautifully arranged in an elegant swan-shaped woven basket. Perfect as a bold centerpiece, an entryway accent, or a conversation piece in any modern or eclectic decor.",70,USD,1,"swan,feather,ostrich,grapevine,ferns,floral,arrangement,bonnielassflorals","grapevine,silk flowers,ostrich feathers,floral foam,wire stakes,floral tape,hot glue",https://i.etsystatic.com/57756784/r/il/35744c/6888748034/il_fullxfull.6888748034_2ydr.jpg,https://i.etsystatic.com/57756784/r/il/463f57/6936722523/il_fullxfull.6936722523_ndht.jpg,,,,,,,,,,,,,,,
"Unique Blue Jeans Shaped Wall Vase with Butterfly & Flowers","Add a fun and quirky touch to your decor with this unique wall hanging! This artificial floral arrangement comes in a cool blue jeans-shaped container/vase, complete with a decorative butterfly detail. Features a lively mix of yellow, white, and dark blue artificial flowers and greenery. Perfect for a casual living space, a teen's room, a laundry room, or any spot needing a pop of personality.",40,USD,1,"artificial,silk,floral,arrangement,jean-vase,cheery,spring,lily,carnation,bonnielassflorals","silk flowers,silk greens,ceramic,wooden stakes,floral foam,floral tape,hot glue",https://i.etsystatic.com/57756784/r/il/cfcc69/6888620508/il_fullxfull.6888620508_iifo.jpg,https://i.etsystatic.com/57756784/r/il/5791fc/6809952600/il_fullxfull.6809952600_ij2c.jpg,,,,,,,,,,,,,,,
"Sunny Sunflower Wreath with Inspirational ""LIFE"" Quote Sign","Bring warmth and inspiration to your home with this beautiful artificial sunflower wreath! Features a prominent ""LIFE"" sign with an uplifting quote (""Dance like nobody's watching, love like you've never been hurt, sing like nobody's listening, and live like it's heaven on earth.""). Adorned with vibrant yellow sunflowers and lush green foliage on a natural twig base. Perfect for a front door, entryway, or a special wall in your living space. Excellent condition.",75,USD,1,"rustic,floral,arrangement,decor,doorhanger,summer,bonnielassflorals","silk flowers,silk greens,plastic stems,grapevine,hot glue,wooden stakes,metal wire",https://i.etsystatic.com/57756784/r/il/8e3ad2/6936629913/il_fullxfull.6936629913_m4dj.jpg,https://i.etsystatic.com/57756784/r/il/8144c3/6832271024/il_fullxfull.6832271024_b5kd.jpg,,,,,,,,,,,,,,,
"Pink Rose And Lavender Arrangement In Metal Container","A pretty traditional floral arrangement in an oval, galvanized metal container. The arrangement primarily features artificial light pink roses with slightly darker pink centers. The roses are interspersed with sprigs and artificial lavender, adding a touch of purple to the composition.

Green artificial leaves, some with white variegated edges, fill out the base of the arrangement, spilling slightly over the edge.",40,USD,1,"floral_arrangement,artificial,silk_flowers,home_decor,galvanized_metal,pot,traditional,rustic,bonnielassflorals","silk flowers,silk greenery,galvanized metal,wood stakes,floral tape,hot glue",https://i.etsystatic.com/57756784/r/il/ea4652/6936401577/il_fullxfull.6936401577_sfrp.jpg,https://i.etsystatic.com/57756784/r/il/6e4e19/6888439622/il_fullxfull.6888439622_h8wl.jpg,https://i.etsystatic.com/57756784/r/il/81d1f4/6936404805/il_fullxfull.6936404805_ooeh.jpg,,,,,,,,,,,,,,
"Lilac-colored pedastal vase arrangement","Lilac vase adorned with a nice purple bow with purple wisteria and white flower arrangement, green ivy and lily stems.",45,USD,1,"purple,floral,white,arrangement,ceramic,spring,lilac,traditional,home_decor,urn,bonnielassflorals","ceramic,plastic flowers,fabric flowers,plastic leaves,fabric leaves",https://i.etsystatic.com/57756784/r/il/acd94b/6832290620/il_fullxfull.6832290620_7tqn.jpg,https://i.etsystatic.com/57756784/r/il/d21e6f/6832301236/il_fullxfull.6832301236_3nol.jpg,https://i.etsystatic.com/57756784/r/il/2fb70c/6832362602/il_fullxfull.6832362602_jneo.jpg,,,,,,,,,,,,,,
"Metal Wall Floral Arrangement In Elegant Container","One-sided arrangement in a dark bronze metal container. Holding bright sunflowers, red and yellow tulips, orchids, and Ivy.",45,USD,1,"floral,arrangement,spring,elegant,beautiful,bonnielassflorals","silk flowers,metal,silk greens,wooden stakes,floral foam,floral tape,hot glue",https://i.etsystatic.com/57756784/r/il/4d6b5d/6936567255/il_fullxfull.6936567255_hru9.jpg,https://i.etsystatic.com/57756784/r/il/1d55e0/6888593364/il_fullxfull.6888593364_l31q.jpg,https://i.etsystatic.com/57756784/r/il/115844/6936567253/il_fullxfull.6936567253_du0p.jpg,https://i.etsystatic.com/57756784/r/il/3eef26/6833550560/il_fullxfull.6833550560_iv0m.jpg,https://i.etsystatic.com/57756784/r/il/9fcf56/6833546560/il_fullxfull.6833546560_9k4o.jpg,https://i.etsystatic.com/57756784/r/il/75de00/6833549750/il_fullxfull.6833549750_tayt.jpg,,,,,,,,,,,
"Red Rooster ceramic pitcher floral arrangement","Really cute red rooster ceramic pitcher. Arrangement has sunflowers, red cosmos flowers, and yellow lark spur. The greenery is fern and ficus.",75,USD,1,"ceramic,potted,floral,spring,red,rooster,decorative,decor,bonnielassflorals","silk flowers,silk foliage,ceramics,floral tape,hot glue",https://i.etsystatic.com/57756784/r/il/255e54/6936742611/il_fullxfull.6936742611_91rk.jpg,https://i.etsystatic.com/57756784/r/il/dda581/6936693551/il_fullxfull.6936693551_dg95.jpg,https://i.etsystatic.com/57756784/r/il/dd3aa4/6888721046/il_fullxfull.6888721046_7mmu.jpg,,,,,,,,,,,,,,
"Cute ceramic bucket with flowers and rabbits and an elegant floral arrangement.","Cute ceramic bucket with flowers and rabbits. The arrangement has pink and white roses with purple grape hyacinths.",35,USD,1,"ceramic,floral,arrangement,spring,bunnies,cute,elegant,bonnielassflorals","silk flowers,silk foliage,ceramics",https://i.etsystatic.com/57756784/r/il/cebf83/6888495826/il_fullxfull.6888495826_soxc.jpg,https://i.etsystatic.com/57756784/r/il/185d98/6787658120/il_fullxfull.6787658120_f0z4.jpg,,,,,,,,,,,,,,,
